{
  "schema_version": "3.1.0-lean.2",
  "run_id": "LRUN2-9ae2456e0f2699bd",
  "stage": "D2R",
  "split": "development",
  "case_set": [
    "OM-P02",
    "MGMT-P02",
    "IS-P02",
    "OR-P01",
    "IS-P01"
  ],
  "control_cases": [
    "OR-P01",
    "IS-P01"
  ],
  "required_call_cap": 20,
  "conditional_adjudication_cap": 5,
  "maximum_calls": 25,
  "calls_used": 0,
  "attempts_used": 0,
  "status": "planned",
  "holdout_states": {
    "expert_holdout_unopened": true,
    "automated_holdout_unopened": true
  },
  "created_at": "2026-07-22T11:28:23.744919Z",
  "updated_at": "2026-07-22T11:28:23.744919Z",
  "calls": [
    {
      "call_id": "LCALL2-70589bf8b6aa7c91",
      "call_kind": "required",
      "case_id": "OM-P02",
      "role": "role_a",
      "prompt_hash": "2ba415fde651465a5e9d41c4aed89a6e3b7622934789ed95b02ac9c46fb8f783",
      "provider": "OpenAI",
      "model_id": "gpt-5.6-sol",
      "family_claim": "same_family",
      "settings": {
        "reasoning_effort": "high",
        "sampling_controls": "unavailable"
      },
      "status": "planned",
      "attempts": 0,
      "packet_sha256": "ecff37eea4a703a3b867e233f1cc7f20dd17ac4ba7b9d2ce759e7f3a912538f1",
      "output_ref": null,
      "output_sha256": null,
      "schema_valid": null,
      "started_at": null,
      "completed_at": null
    },
    {
      "call_id": "LCALL2-c72f5e7ed451eefa",
      "call_kind": "required",
      "case_id": "OM-P02",
      "role": "role_b",
      "prompt_hash": "0593450dde8c71791bd59213d4e588589e049b2a9623a38b3a4a3402c77ae93f",
      "provider": "OpenAI",
      "model_id": "gpt-5.6-terra",
      "family_claim": "same_family",
      "settings": {
        "reasoning_effort": "high",
        "sampling_controls": "unavailable"
      },
      "status": "planned",
      "attempts": 0,
      "packet_sha256": "ecff37eea4a703a3b867e233f1cc7f20dd17ac4ba7b9d2ce759e7f3a912538f1",
      "output_ref": null,
      "output_sha256": null,
      "schema_valid": null,
      "started_at": null,
      "completed_at": null
    },
    {
      "call_id": "LCALL2-74ef087a249be289",
      "call_kind": "required",
      "case_id": "OM-P02",
      "role": "role_c",
      "prompt_hash": "8e1bc7fc6097dba2949bb0be259f14f7f09197a4019268f738c92318639170f5",
      "provider": "OpenAI",
      "model_id": "gpt-5.6-sol",
      "family_claim": "same_family",
      "settings": {
        "reasoning_effort": "high",
        "sampling_controls": "unavailable"
      },
      "status": "planned",
      "attempts": 0,
      "packet_sha256": "ecff37eea4a703a3b867e233f1cc7f20dd17ac4ba7b9d2ce759e7f3a912538f1",
      "output_ref": null,
      "output_sha256": null,
      "schema_valid": null,
      "started_at": null,
      "completed_at": null
    },
    {
      "call_id": "LCALL2-33850bde53a9713f",
      "call_kind": "required",
      "case_id": "OM-P02",
      "role": "contrast_judge",
      "prompt_hash": "0cb7bacfc525131345a8f43dfaf96ad8993e7043f874587e2e446852a62b5802",
      "provider": "OpenAI",
      "model_id": "gpt-5.6-terra",
      "family_claim": "same_family",
      "settings": {
        "reasoning_effort": "high",
        "sampling_controls": "unavailable"
      },
      "status": "planned",
      "attempts": 0,
      "packet_sha256": "ecff37eea4a703a3b867e233f1cc7f20dd17ac4ba7b9d2ce759e7f3a912538f1",
      "output_ref": null,
      "output_sha256": null,
      "schema_valid": null,
      "started_at": null,
      "completed_at": null
    },
    {
      "call_id": "LCALL2-7d05f344dff1e13b",
      "call_kind": "conditional",
      "case_id": "OM-P02",
      "role": "adjudicator",
      "prompt_hash": "c76712b40f1260f127289056e22d4f36be081a609d0d4138374c9d3e5b25c156",
      "provider": "OpenAI",
      "model_id": "gpt-5.6-sol",
      "family_claim": "same_family",
      "settings": {
        "reasoning_effort": "xhigh",
        "sampling_controls": "unavailable"
      },
      "status": "not_required",
      "attempts": 0,
      "packet_sha256": "ecff37eea4a703a3b867e233f1cc7f20dd17ac4ba7b9d2ce759e7f3a912538f1",
      "output_ref": null,
      "output_sha256": null,
      "schema_valid": null,
      "started_at": null,
      "completed_at": null
    },
    {
      "call_id": "LCALL2-e267613b2925e6e0",
      "call_kind": "required",
      "case_id": "MGMT-P02",
      "role": "role_a",
      "prompt_hash": "2ba415fde651465a5e9d41c4aed89a6e3b7622934789ed95b02ac9c46fb8f783",
      "provider": "OpenAI",
      "model_id": "gpt-5.6-sol",
      "family_claim": "same_family",
      "settings": {
        "reasoning_effort": "high",
        "sampling_controls": "unavailable"
      },
      "status": "planned",
      "attempts": 0,
      "packet_sha256": "cdc544f4179cb90dcbd8f74e321c92a9528513e6cf7f08c1ac07ed68ad1e14b9",
      "output_ref": null,
      "output_sha256": null,
      "schema_valid": null,
      "started_at": null,
      "completed_at": null
    },
    {
      "call_id": "LCALL2-9b7ce6374f04a084",
      "call_kind": "required",
      "case_id": "MGMT-P02",
      "role": "role_b",
      "prompt_hash": "0593450dde8c71791bd59213d4e588589e049b2a9623a38b3a4a3402c77ae93f",
      "provider": "OpenAI",
      "model_id": "gpt-5.6-terra",
      "family_claim": "same_family",
      "settings": {
        "reasoning_effort": "high",
        "sampling_controls": "unavailable"
      },
      "status": "planned",
      "attempts": 0,
      "packet_sha256": "cdc544f4179cb90dcbd8f74e321c92a9528513e6cf7f08c1ac07ed68ad1e14b9",
      "output_ref": null,
      "output_sha256": null,
      "schema_valid": null,
      "started_at": null,
      "completed_at": null
    },
    {
      "call_id": "LCALL2-6ad73f59d6704429",
      "call_kind": "required",
      "case_id": "MGMT-P02",
      "role": "role_c",
      "prompt_hash": "8e1bc7fc6097dba2949bb0be259f14f7f09197a4019268f738c92318639170f5",
      "provider": "OpenAI",
      "model_id": "gpt-5.6-sol",
      "family_claim": "same_family",
      "settings": {
        "reasoning_effort": "high",
        "sampling_controls": "unavailable"
      },
      "status": "planned",
      "attempts": 0,
      "packet_sha256": "cdc544f4179cb90dcbd8f74e321c92a9528513e6cf7f08c1ac07ed68ad1e14b9",
      "output_ref": null,
      "output_sha256": null,
      "schema_valid": null,
      "started_at": null,
      "completed_at": null
    },
    {
      "call_id": "LCALL2-a7505a63641e8444",
      "call_kind": "required",
      "case_id": "MGMT-P02",
      "role": "contrast_judge",
      "prompt_hash": "0cb7bacfc525131345a8f43dfaf96ad8993e7043f874587e2e446852a62b5802",
      "provider": "OpenAI",
      "model_id": "gpt-5.6-terra",
      "family_claim": "same_family",
      "settings": {
        "reasoning_effort": "high",
        "sampling_controls": "unavailable"
      },
      "status": "planned",
      "attempts": 0,
      "packet_sha256": "cdc544f4179cb90dcbd8f74e321c92a9528513e6cf7f08c1ac07ed68ad1e14b9",
      "output_ref": null,
      "output_sha256": null,
      "schema_valid": null,
      "started_at": null,
      "completed_at": null
    },
    {
      "call_id": "LCALL2-8e97335a1e95528c",
      "call_kind": "conditional",
      "case_id": "MGMT-P02",
      "role": "adjudicator",
      "prompt_hash": "c76712b40f1260f127289056e22d4f36be081a609d0d4138374c9d3e5b25c156",
      "provider": "OpenAI",
      "model_id": "gpt-5.6-sol",
      "family_claim": "same_family",
      "settings": {
        "reasoning_effort": "xhigh",
        "sampling_controls": "unavailable"
      },
      "status": "not_required",
      "attempts": 0,
      "packet_sha256": "cdc544f4179cb90dcbd8f74e321c92a9528513e6cf7f08c1ac07ed68ad1e14b9",
      "output_ref": null,
      "output_sha256": null,
      "schema_valid": null,
      "started_at": null,
      "completed_at": null
    },
    {
      "call_id": "LCALL2-be445f5381a70659",
      "call_kind": "required",
      "case_id": "IS-P02",
      "role": "role_a",
      "prompt_hash": "2ba415fde651465a5e9d41c4aed89a6e3b7622934789ed95b02ac9c46fb8f783",
      "provider": "OpenAI",
      "model_id": "gpt-5.6-sol",
      "family_claim": "same_family",
      "settings": {
        "reasoning_effort": "high",
        "sampling_controls": "unavailable"
      },
      "status": "planned",
      "attempts": 0,
      "packet_sha256": "515791b17366dcefbfafafc460d93fcce22ef2b4747512b44cc968e035e29026",
      "output_ref": null,
      "output_sha256": null,
      "schema_valid": null,
      "started_at": null,
      "completed_at": null
    },
    {
      "call_id": "LCALL2-e14dbcb1374dc311",
      "call_kind": "required",
      "case_id": "IS-P02",
      "role": "role_b",
      "prompt_hash": "0593450dde8c71791bd59213d4e588589e049b2a9623a38b3a4a3402c77ae93f",
      "provider": "OpenAI",
      "model_id": "gpt-5.6-terra",
      "family_claim": "same_family",
      "settings": {
        "reasoning_effort": "high",
        "sampling_controls": "unavailable"
      },
      "status": "planned",
      "attempts": 0,
      "packet_sha256": "515791b17366dcefbfafafc460d93fcce22ef2b4747512b44cc968e035e29026",
      "output_ref": null,
      "output_sha256": null,
      "schema_valid": null,
      "started_at": null,
      "completed_at": null
    },
    {
      "call_id": "LCALL2-b50d399f764dcc38",
      "call_kind": "required",
      "case_id": "IS-P02",
      "role": "role_c",
      "prompt_hash": "8e1bc7fc6097dba2949bb0be259f14f7f09197a4019268f738c92318639170f5",
      "provider": "OpenAI",
      "model_id": "gpt-5.6-sol",
      "family_claim": "same_family",
      "settings": {
        "reasoning_effort": "high",
        "sampling_controls": "unavailable"
      },
      "status": "planned",
      "attempts": 0,
      "packet_sha256": "515791b17366dcefbfafafc460d93fcce22ef2b4747512b44cc968e035e29026",
      "output_ref": null,
      "output_sha256": null,
      "schema_valid": null,
      "started_at": null,
      "completed_at": null
    },
    {
      "call_id": "LCALL2-ace17622a566a5ee",
      "call_kind": "required",